{
  "id": "workflow-zentrale",
  "name": "Workflow-Zentrale",
  "version": "1.0.0",
  "type": "overview",
  "description": "Live-Übersicht, Kennzahlen, nächste Termine und Schnellaktionen.",
  "entry": {
    "html": null,
    "css": null,
    "js": null
  },
  "permissions": [
    "local-storage"
  ],
  "storage": {
    "scope": "module",
    "backupRequired": false
  },
  "validation": {
    "maxInputBytes": 0,
    "allowedFileExtensions": []
  }
}
